<?xml version="1.0" encoding="UTF-8"?>

<GCMApplication
	xmlns="http://www-sop.inria.fr/oasis/ProActive/schemas/ApplicationDescriptorSchema"
	xmlns:xsi="http://www.w3.org/2001/XMLSchema-instance"
	xsi:schemaLocation="http://www-sop.inria.fr/oasis/ProActive/schemas/ApplicationDescriptorSchema ../schema/ApplicationDescriptorSchema.xsd">

    <ressourceAllocator id="RA" descriptor="INRIA_LAN.xml" >
        <ProActive name="proactive"/> 
    </ressourceAllocator>   
    
    <application>
        <virtualNode name="VN1" capacity="12">
            <ressourceAllocators>
                <ressourceAllocator refid="RA1"/>
                <ressourceAllocator refid="RA2"/>
            </ressourceAllocators>
         </virtualNode>
        
        <coallocation raref="RA" capacity="max">
            <virtualNode name="VN2"/>
            <virtualNode name="VN3"/>
        </coallocation>  
    </application>
</GCMApplication>        
